{
  "$schema": "https://json-schema.org/draft/2020-12/schema",
  "title": "STOGAF Viewpoint Projection",
  "type": "object",
  "required": [
    "id",
    "view",
    "concern",
    "projection"
  ],
  "properties": {
    "id": {
      "type": "string"
    },
    "view": {
      "type": "string"
    },
    "concern": {
      "type": "string"
    },
    "projection": {
      "type": "string"
    }
  },
  "additionalProperties": true
}
